{
  "id": "plugin-evals",
  "slug": "plugin-evals",
  "name": "Evals",
  "description": "Create and run repeatable workspace-scoped evaluations that measure agent and workflow output quality, scores, progress, and execution history.",
  "version": "0.2.0-test",
  "icon": "beaker",
  "objectKind": "eval",
  "visibility": "private",
  "enabledByDefault": false,
  "source": {
    "type": "github",
    "owner": "Maximilien-ai",
    "repo": "clawmax",
    "url": "https://github.com/Maximilien-ai/clawmax/tree/main/PLUGINS/test/plugin-evals",
    "branch": "main"
  },
  "nav": {
    "section": "plugins",
    "order": 10,
    "label": "Evals"
  },
  "capabilities": {
    "notifications": true,
    "docs": true,
    "agents": true,
    "workflows": true,
    "communications": true
  },
  "labels": {
    "singular": "Eval",
    "plural": "Evals"
  }
}
