{
  "id": "plugin-lab-guardrails",
  "slug": "plugin-lab-guardrails",
  "name": "Guardrails Test Plugin",
  "description": "A dormant reference plugin for workspace-scoped guardrail objects.",
  "version": "0.1.0-mvp0",
  "icon": "shield",
  "objectKind": "guardrail",
  "visibility": "private",
  "enabledByDefault": true,
  "source": {
    "type": "github",
    "owner": "example",
    "repo": "plugin-lab-guardrails",
    "url": "https://example.invalid/plugin-lab-guardrails",
    "branch": "main"
  },
  "nav": {
    "section": "plugins",
    "order": 10
  },
  "capabilities": {
    "notifications": true,
    "docs": true,
    "agents": true,
    "workflows": true,
    "communications": true
  },
  "labels": {
    "singular": "Guardrail",
    "plural": "Guardrails"
  }
}
