{
  "id": "plugin-lab-evals",
  "slug": "plugin-lab-evals",
  "name": "Evals Test Plugin",
  "description": "A dormant reference plugin for workspace-scoped eval experiments.",
  "version": "0.1.0-mvp0",
  "icon": "beaker",
  "objectKind": "eval",
  "visibility": "private",
  "enabledByDefault": true,
  "source": {
    "type": "github",
    "owner": "example",
    "repo": "plugin-lab-evals",
    "url": "https://example.invalid/plugin-lab-evals",
    "branch": "main"
  },
  "nav": {
    "section": "plugins",
    "order": 20
  },
  "capabilities": {
    "notifications": true,
    "docs": true,
    "agents": true,
    "workflows": true,
    "communications": true
  },
  "labels": {
    "singular": "Eval",
    "plural": "Evals"
  }
}
