{
  "id": "plugin-guardrails",
  "slug": "plugin-guardrails",
  "name": "Guardrails",
  "description": "Create, apply, and review workspace-scoped controls that constrain agent and workflow behavior while preserving clear ownership and activation history.",
  "version": "0.2.0-test",
  "icon": "shield",
  "objectKind": "guardrail",
  "visibility": "private",
  "enabledByDefault": false,
  "source": {
    "type": "github",
    "owner": "Maximilien-ai",
    "repo": "clawmax",
    "url": "https://github.com/Maximilien-ai/clawmax/tree/main/PLUGINS/test/plugin-guardrails",
    "branch": "main"
  },
  "nav": {
    "section": "plugins",
    "order": 20,
    "label": "Guardrails"
  },
  "capabilities": {
    "notifications": true,
    "docs": true,
    "agents": true,
    "workflows": true,
    "communications": true
  },
  "labels": {
    "singular": "Guardrail",
    "plural": "Guardrails"
  }
}
